<AttributeResolver xmlns:xsi="http://www.w3.org/2001/XMLSchema-instance" xmlns="urn:mace:shibboleth:resolver:1.0" xsi:schemaLocation="urn:mace:shibboleth:resolver:1.0 shibboleth-resolver-1.0.xsd">
	
	<SimpleAttributeDefinition id="urn:mace:dir:attribute-def:eduPersonEntitlement">
		<DataConnectorDependency requires="echo"/>
	</SimpleAttributeDefinition>
	
	<SimpleAttributeDefinition id="urn:mace:dir:attribute-def:eduPersonAffiliation">
		<DataConnectorDependency requires="echo"/>
	</SimpleAttributeDefinition>
	
	<SimpleAttributeDefinition id="urn:mace:dir:attribute-def:eduPersonNickname">
		<DataConnectorDependency requires="echo"/>
	</SimpleAttributeDefinition>
	
	<SimpleAttributeDefinition id="urn:mace:dir:attribute-def:eduPersonPrimaryAffiliation">
		<DataConnectorDependency requires="echo"/>
	</SimpleAttributeDefinition>
	
	<SimpleAttributeDefinition id="urn:mace:dir:attribute-def:eduPersonPrimaryOrgUnitDN">
		<DataConnectorDependency requires="echo"/>
	</SimpleAttributeDefinition>
	
	<SimpleAttributeDefinition id="urn:mace:dir:attribute-def:eduPersonOrgUnitDN">
		<DataConnectorDependency requires="echo"/>
	</SimpleAttributeDefinition>
	
	<SimpleAttributeDefinition id="urn:mace:dir:attribute-def:eduPersonOrgDN">
		<DataConnectorDependency requires="echo"/>
	</SimpleAttributeDefinition>
	
	
	<!-- To use these attributes, you should change the smartScope value to match your site's domain name. -->
	<!--
	<SimpleAttributeDefinition id="urn:mace:dir:attribute-def:eduPersonScopedAffiliation" smartScope="shibdev.edu">
		<AttributeDependency requires="urn:mace:dir:attribute-def:eduPersonAffiliation"/>
	</SimpleAttributeDefinition>

	<SimpleAttributeDefinition id="urn:mace:dir:attribute-def:eduPersonPrincipalName" smartScope="shibdev.edu">
    	<DataConnectorDependency requires="echo"/>
	</SimpleAttributeDefinition>
	-->
	
	
	<!-- Example persistent id attribute.  You should change the scope value to match your site's domain 
		 name.  Since this configuration is permanent, some thought is required before deploying in 
		 production. -->
	<!--
	<PersistentIDAttributeDefinition id="urn:mace:dir:attribute-def:eduPersonTargetedID" scope="shibdev.edu" sourceName="guid">
		<DataConnectorDependency requires="echo"/>
		<Salt keyStorePath="/conf/persistent.jks" keyStoreKeyAlias="handleKey" keyStorePassword="shibhs" keyStoreKeyPassword="shibhs"/>
	</PersistentIDAttributeDefinition>
	-->
	
	
	<!--Examples of common ldap-based attributes -->
	<!--
	<SimpleAttributeDefinition id="urn:mace:dir:attribute-def:cn">
		<DataConnectorDependency requires="echo"/>
	</SimpleAttributeDefinition>
	
	<SimpleAttributeDefinition id="urn:mace:dir:attribute-def:sn">
		<DataConnectorDependency requires="echo"/>
	</SimpleAttributeDefinition>
	
	<SimpleAttributeDefinition id="urn:mace:dir:attribute-def:telephoneNumber">
		<DataConnectorDependency requires="echo"/>
	</SimpleAttributeDefinition>
	
	<SimpleAttributeDefinition id="urn:mace:dir:attribute-def:title">
		<DataConnectorDependency requires="echo"/>
	</SimpleAttributeDefinition>
	
	<SimpleAttributeDefinition id="urn:mace:dir:attribute-def:initials">
		<DataConnectorDependency requires="echo"/>
	</SimpleAttributeDefinition>
	
	<SimpleAttributeDefinition id="urn:mace:dir:attribute-def:description">
		<DataConnectorDependency requires="echo"/>
	</SimpleAttributeDefinition>
	
	<SimpleAttributeDefinition id="urn:mace:dir:attribute-def:carLicense">
		<DataConnectorDependency requires="echo"/>
	</SimpleAttributeDefinition>
	
	<SimpleAttributeDefinition id="urn:mace:dir:attribute-def:departmentNumber">
		<DataConnectorDependency requires="echo"/>
	</SimpleAttributeDefinition>
	
	<SimpleAttributeDefinition id="urn:mace:dir:attribute-def:displayName">
		<DataConnectorDependency requires="echo"/>
	</SimpleAttributeDefinition>
	
	<SimpleAttributeDefinition id="urn:mace:dir:attribute-def:employeeNumber">
		<DataConnectorDependency requires="echo"/>
	</SimpleAttributeDefinition>
	
	<SimpleAttributeDefinition id="urn:mace:dir:attribute-def:employeeType">
		<DataConnectorDependency requires="echo"/>
	</SimpleAttributeDefinition>
	
	<SimpleAttributeDefinition id="urn:mace:dir:attribute-def:preferredLanguage">
		<DataConnectorDependency requires="echo"/>
	</SimpleAttributeDefinition>
	
	<SimpleAttributeDefinition id="urn:mace:dir:attribute-def:manager">
		<DataConnectorDependency requires="echo"/>
	</SimpleAttributeDefinition>
	
	<SimpleAttributeDefinition id="urn:mace:dir:attribute-def:roomNumber">
		<DataConnectorDependency requires="echo"/>
	</SimpleAttributeDefinition>
	
	<SimpleAttributeDefinition id="urn:mace:dir:attribute-def:seeAlso">
		<DataConnectorDependency requires="echo"/>
	</SimpleAttributeDefinition>
	
	<SimpleAttributeDefinition id="urn:mace:dir:attribute-def:facsimileTelephoneNumber">
		<DataConnectorDependency requires="echo"/>
	</SimpleAttributeDefinition>
	
	<SimpleAttributeDefinition id="urn:mace:dir:attribute-def:street">
		<DataConnectorDependency requires="echo"/>
	</SimpleAttributeDefinition>
	
	<SimpleAttributeDefinition id="urn:mace:dir:attribute-def:postOfficeBox">
		<DataConnectorDependency requires="echo"/>
	</SimpleAttributeDefinition>
	
	<SimpleAttributeDefinition id="urn:mace:dir:attribute-def:postalCode">
		<DataConnectorDependency requires="echo"/>
	</SimpleAttributeDefinition>
	
	<SimpleAttributeDefinition id="urn:mace:dir:attribute-def:st">
		<DataConnectorDependency requires="echo"/>
	</SimpleAttributeDefinition>
	
	<SimpleAttributeDefinition id="urn:mace:dir:attribute-def:givenName">
		<DataConnectorDependency requires="echo"/>
	</SimpleAttributeDefinition>
	
	<SimpleAttributeDefinition id="urn:mace:dir:attribute-def:l">
		<DataConnectorDependency requires="echo"/>
	</SimpleAttributeDefinition>
	
	<SimpleAttributeDefinition id="urn:mace:dir:attribute-def:businessCategory">
		<DataConnectorDependency requires="echo"/>
	</SimpleAttributeDefinition>
	
	<SimpleAttributeDefinition id="urn:mace:dir:attribute-def:ou">
		<DataConnectorDependency requires="echo"/>
	</SimpleAttributeDefinition>
	
	<SimpleAttributeDefinition id="urn:mace:dir:attribute-def:physicalDeliveryOfficeName">
		<DataConnectorDependency requires="echo"/>
	</SimpleAttributeDefinition>
	-->
	
	
	<CustomDataConnector id="echo" class="edu.internet2.middleware.shibboleth.aa.attrresolv.provider.SampleConnector"/>

</AttributeResolver>
