<AttributeResolver xmlns:xsi="http://www.w3.org/2001/XMLSchema-instance" 
	xmlns="urn:mace:shibboleth:resolver:1.0" 
	xsi:schemaLocation="urn:mace:shibboleth:resolver:1.0 ../../src/schemas/shibboleth-resolver-1.0.xsd">
	
	<SimpleAttributeDefinition id="urn:mace:dir:attribute-def:eduPersonEntitlement">
		<DataConnectorDependency requires="jutest"/>
	</SimpleAttributeDefinition>
	
	<SimpleAttributeDefinition id="urn:mace:dir:attribute-def:title">
		<DataConnectorDependency requires="jutest"/>
	</SimpleAttributeDefinition>
	
	<SimpleAttributeDefinition id="urn:mace:dir:attribute-def:eduPersonAffiliation">
		<DataConnectorDependency requires="jutest"/>
	</SimpleAttributeDefinition>
		
	<SimpleAttributeDefinition id="urn:mace:dir:attribute-def:eduPersonScopedAffiliation"
		smartScope="example.org">
		<DataConnectorDependency requires="jutest"/>
	</SimpleAttributeDefinition>
	
	<SimpleAttributeDefinition id="urn:mace:dir:attribute-def:telephoneNumber">
		<DataConnectorDependency requires="jutest"/>
	</SimpleAttributeDefinition>
	
	<SimpleAttributeDefinition id="urn:mace:dir:attribute-def:cn">
		<DataConnectorDependency requires="jutest"/>
	</SimpleAttributeDefinition>
	
	<SimpleAttributeDefinition id="urn:mace:dir:attribute-def:givenName">
		<DataConnectorDependency requires="jutest"/>
	</SimpleAttributeDefinition>
		
	<SimpleAttributeDefinition id="urn:mace:dir:attribute-def:surname">
		<DataConnectorDependency requires="jutest"/>
	</SimpleAttributeDefinition>
		
	<SimpleAttributeDefinition id="urn:mace:dir:attribute-def:unacceptable">
		<DataConnectorDependency requires="jutest"/>
	</SimpleAttributeDefinition>
			
	<SimpleAttributeDefinition id="urn:mace:dir:attribute-def:unreleasable">
		<DataConnectorDependency requires="jutest"/>
	</SimpleAttributeDefinition>
			
	<SimpleAttributeDefinition id="urn:mace:dir:attribute-def:eduPersonPrincipalName"
		smartScope="example.org">
		<DataConnectorDependency requires="jutest"/>
	</SimpleAttributeDefinition>
					
	<CustomDataConnector id="jutest" class="edu.internet2.middleware.shibboleth.runner.AttributeSourceForTests"/>

</AttributeResolver>
